number,name,brand,description,category,image
8230BLK-3,Bastrop Collection ,Homelegance,"Comfort is the name of the game in the Bastrop Collection. The collection is offered in several configurations – traditional sofa, love seat and chair, and sectional – for versatile placement in your living room maximum relaxation potential in your downtime. The two optional coverings – black or brown leather gel match – feature contrast welting for definition of profile and modern accenting. Manually engaged motion mechanisms allow for quick transition from seated to prone with the quick pull of a tab. Each piece in the collection has an individual function allowing for convenience and comfort. The sofa features dual reclining ends, the dual glider reclining ends of the love seat flank a center mounted console with storage and cup-holders, and the chair features a glider mechanism that allows for easy back and forth motion. The sectional configuration features a left side love seat with reclining end and the right side double reclining love seat with center console unit featuring cup holders and storage.",seating,https://s3-us-west-1.amazonaws.com/homelegance-resized/Images_MidRes_For+Customer+Advertisement/8230BLK.jpg
8019,Polson Collection ,Homelegance,"Standing as a bold statement in your living room, the Polson Collection provides the perfect platform for your media storage and display. Bookshelf storage rises from each side to flank the lower television stand. The espresso finish is contrasted by the brushed satin nickel knobs that front the ample storage drawers and doors. Scoring and use of double knobs give the illusion of additional drawer storage. X-framing that is boldly featured on the side pier bookcases lends a trendy feel to this functional media unit.",home,https://s3-us-west-1.amazonaws.com/homelegance-resized/Images_MidRes_For+Customer+Advertisement/8019-shot2_mixing color_2014H-1.jpg
8300-3PW,Vortex Collection ,Homelegance,"Providing a bold contemporary look for the modern living space, the Vortex Collection creates the perfect platform for relaxation. With the press of a button, the end seats on the sofa, love seat, and chair recline to a prone position. The adjustable headrests provide additional comfort for the user. A low profile seating combined with light grey leather match and stainless steel feet result in the ultra-modern feel of the collection.",seating,https://s3-us-west-1.amazonaws.com/homelegance-resized/Images_MidRes_For+Customer+Advertisement/8300.jpg
8308-3PW,Olympia Collection ,Homelegance,"There is no mistaking the Olympia Collection for anything but a bold study on contemporary design. Sleek lines extend with the push of a button on taking you from a seated to prone position with amazing ease, whether you are on the dual reclining sofa, dual reclining love seat, or reclining chair. The raisin tone top grain leather covers the seats, top part of the arms and front part of the backs, while leather match covers those areas beyond your initial reach. White contrast stitching further accents the design. The collection is available in several different configurations to choose from to complete your seating arrangement.",seating,https://s3-us-west-1.amazonaws.com/homelegance-resized/Images_MidRes_For+Customer+Advertisement/8308.jpg
9668BRW,Center Hill Collection ,Homelegance,"With plush seating that is uncommon in most traditional looks, the design of Center Hill Collection will be a welcome addition to your living room. Offered in bonded leather match, the covering comes in either dark brown or black. With traditional nailhead accent lending an elegant statement to each piece and the easy recline mechanisms adding to the comfort, the lovely Center Hill Collection will provide your friends and family a warm environment to spend their quality moment.",seating,https://s3-us-west-1.amazonaws.com/homelegance-resized/Images_MidRes_For+Customer+Advertisement/9668BRW_3468-30_2014S-12.jpg
8490,Columbus Collection ,Homelegance,"With a configuration options that allow for placement that is perfect for your space, the Columbus Collection will be a welcome addition to your living room. Ample seating is covered in either cobblestone fabric or dark brown breathable faux leather resulting in a pleasurable seating experience. Bookending this substantially sized seating group are the left or right end units that are offered as reclining chair or push back chaise. Armless chair, console unit, corner seat, and armless reclining chair make up the middle part of this sectional offering.",seating,https://s3-us-west-1.amazonaws.com/homelegance-resized/Images_MidRes_For+Customer+Advertisement/8490 6LRRR_LR CN AC CR AR RR 3292.jpg
8413GY-3,Adair Collection ,Homelegance,"The Adair Collection offers a classic look to your stylish home. Classic lines form the profile of this versatile look. Offered in 4 trend-driven colors - teal, grey, yellow and beige - your choice of fabric will allow for your decorative personality to shine.",seating,https://s3-us-west-1.amazonaws.com/homelegance-resized/Images_MidRes_For+Customer+Advertisement/8413GY_all_mixing color (2015).jpg
8327BE-3,Deryn Collection ,Homelegance,"Mid-Century modern design is the inspiration for the Deryn Collection. Wide, dramatically curved arms rise to the straight back that is synonymous with this classic style. Contrast toss pillows and an additional chair option are featured in a modern teal or grey herringbone pattern to complement the teal, beige and grey seating body covers. Natural tone finished legs support the frame while tailored stitch tufting lends further accent to this thoroughly modern collection.",seating,https://s3-us-west-1.amazonaws.com/homelegance-resized/Images_MidRes_For+Customer+Advertisement/8327BE.jpg
8059-T,Piedmont Collection ,Homelegance,The classic transitional design and a warm brown cherry finish compliment an array of home entertainment spaces. The Piedmont Collection-s focal points are the concave curved front display shelves and routed pilasters. Media storage features glass-fronted doors for easy remote control access. Ready-To-Assemble construction.,home,https://s3-us-west-1.amazonaws.com/homelegance-resized/Images_MidRes_For+Customer+Advertisement/8059-T._2014H-13.jpg
9724BRW,Marille Collection ,Homelegance,"With either the extended stretch of the reclining sofa or soothing rock of the reclining chair, your comfort is taken care of in the Marille Collection. Drop-down cup holders add additional function to the collection. The collection is offered in brown bonded leather match, black bonded leather match, dark brown 100% polyester or taupe 100% polyester.",seating,https://s3-us-west-1.amazonaws.com/homelegance-resized/Images_MidRes_For+Customer+Advertisement/9724BRW Shot1.jpg
9909BR,Comfort Living Collection ,Homelegance,"The Comfort Living Collection, with our patent pending assembly method, allows you to customize the placement of the back supports to fit your living space needs. Working as either a right OR left facing grouping, the reversible 3-seater and chaise may be placed on either side, optimizing your special needs. Contrasting two-tone rhino microfiber and dark brown bi-cast vinyl lends a contemporary yet relaxed style. Available in chocolate rhino microfiber and brown rhino microfiber. 2 free pillows included.",seating,https://s3-us-west-1.amazonaws.com/homelegance-resized/Images_MidRes_For+Customer+Advertisement/9909BR.jpg
1195F1S,Harmony Collection ,Homelegance,A straight back gives way to the delicate slope of the arms in the Harmony Collection. This elegant accent chair is offered in a neutral beige fabric for ultimate flexibility for placement in your home. Low polish nailhead provides stylish contrast and decorative flair.,seating,https://s3-us-west-1.amazonaws.com/homelegance-resized/Images_MidRes_For+Customer+Advertisement/1195F1S.jpg
8209BR-3SC,Synnove Collection ,Homelegance,"Casual contemporary styling creates a relaxed look for your living room in the Synnove Collection. Light brown fabric covers the reversible configuration of the three seating sectional sofa. Further complemented by the contrasting geometric pattern toss pillows. An ottoman is utilized as the base for the reversible end chaise cushion, creating the option of a left or right extension of the sofa seating. Slightly flared arms lend to the modern profile of the collection.",seating,https://s3-us-west-1.amazonaws.com/homelegance-resized/Images_MidRes_For+Customer+Advertisement/8209BR-3SC.jpg
1194TL,Charisma Collection ,Homelegance,"High polished nailhead accents the profile of the Charisma Collection. This modern traditional accent chair provides a stylish, yet functional addition to your home. The chair is offered in four distinct colors: teal, taupe, indigo and chocolate.",seating,https://s3-us-west-1.amazonaws.com/homelegance-resized/Images_MidRes_For+Customer+Advertisement/1194TL.jpg
1194TP,Charisma Collection ,Homelegance,"High polished nailhead accents the profile of the Charisma Collection. This modern traditional accent chair provides a stylish, yet functional addition to your home. The chair is offered in four distinct colors: teal, taupe, indigo and chocolate.",seating,https://s3-us-west-1.amazonaws.com/homelegance-resized/Images_MidRes_For+Customer+Advertisement/1194TP.jpg
1193F6S,Barlowe Collection ,Homelegance,"A tasteful accent to any room in your home is the Barlowe Collection. The dark cherry finish of the wood legs is a perfect contrast for either the oatmeal linen or the french note fabric offerings. New fabric options include: blue, grey, dark teal, chain link print, and paisley print.",seating,https://s3-us-west-1.amazonaws.com/homelegance-resized/Images_MidRes_For+Customer+Advertisement/1193F6S.jpg
1260F1S,Essex Collection ,Homelegance,"With a classic profile that is covered in a dark grey or blue fabric, the Essex Collection utilizes high polish nail head accenting to provide a modern twist to the design of this elegant accent chair. Rolled tufting furthers the traditional look as do the cherry finished support legs.",seating,https://s3-us-west-1.amazonaws.com/homelegance-resized/Images_MidRes_For+Customer+Advertisement/1260F1S.jpg
8335-4,Alamosa Collection ,Homelegance,Transitionally styled for your home is the Alamosa Collection. Unfettered design allows for placement in a number of casual living room settings. The ottoman features diamond patterned fabric.,seating,https://s3-us-west-1.amazonaws.com/homelegance-resized/Images_MidRes_For+Customer+Advertisement/8335-4.jpg
1266F1S,Rhett Collection ,Homelegance,"Traditionally framed with a slightly flared arm, the wing back Rhett Collection is a welcome addition to your home décor. Contrasting dark nail head accent, and button tufting further the classic look of the collection.",seating,https://s3-us-west-1.amazonaws.com/homelegance-resized/Images_MidRes_For+Customer+Advertisement/1266F1S.jpg
468F25S,Lifestyle Collection ,Homelegance,"When designing your living space the accent pieces you choose not only to fill the room but allow for the expression of your individual style to come shining through. Offered in a multitude of fabrics and frames, our accent collection will compliment your unique style.",seating,https://s3-us-west-1.amazonaws.com/homelegance-resized/Images_MidRes_For+Customer+Advertisement/468F25S_2014H-82.jpg
8230BRW-3,Bastrop Collection ,Homelegance,"Comfort is the name of the game in the Bastrop Collection. The collection is offered in several configurations – traditional sofa, love seat and chair, and sectional – for versatile placement in your living room maximum relaxation potential in your downtime. The two optional coverings – black or brown leather gel match – feature contrast welting for definition of profile and modern accenting. Manually engaged motion mechanisms allow for quick transition from seated to prone with the quick pull of a tab. Each piece in the collection has an individual function allowing for convenience and comfort. The sofa features dual reclining ends, the dual glider reclining ends of the love seat flank a center mounted console with storage and cup-holders, and the chair features a glider mechanism that allows for easy back and forth motion. The sectional configuration features a left side love seat with reclining end and the right side double reclining love seat with center console unit featuring cup holders and storage.",seating,https://s3-us-west-1.amazonaws.com/homelegance-resized/Images_MidRes_For+Customer+Advertisement/8230BRW.jpg
1977T-1,Aviana Collection ,Homelegance,"Created for the traditional bedroom, the Aviana Collection is a study in classic styling and modern presentation. An antiqued gray finish provides an open canvas for your personal decorative touch. Carved feet support classically styled case goods - each featuring teardrop hardware with an antiqued pewter finish. Raised panels further the traditional look of the case piece drawer fronts. The collection is offered in twin, full, queen, eastern king and california king for perfect placement in your home.",youth,https://s3-us-west-1.amazonaws.com/homelegance-resized/Images_MidRes_For+Customer+Advertisement/1977T.jpg
1212F2S,Langdale Collection ,Homelegance,"A tasteful accent to any room in your home is the Langdale Collection. The tufted fan back serves as the focal point, while dark cherry finish, on the wood legs, makes for a perfect contrast against either the Oatmeal-Colored or the French Note fabric offerings.",seating,https://s3-us-west-1.amazonaws.com/homelegance-resized/Images_MidRes_For+Customer+Advertisement/1212f1s_C(2014)_2015S-134.jpg
1386TPP-1,Cinderella Collection ,Homelegance,"The Cinderella Collection is your little girl's dream. The Victorian styling incorporates floral motif hardware, antique ecru finish and traditional carving details that will create the feeling of a room worth of a fairy tale princess. A canopy bed completes the fantasy of this whimsical collection. Turned posts reach for the heights and are topped with carved finials. The additional trundle provides the extra sleeping space for princesses visiting from other kingdoms. Also available in dark cherry finish.",youth,https://s3-us-west-1.amazonaws.com/homelegance-resized/Images_MidRes_For+Customer+Advertisement/1386TPP-1.jpg
B2053PRW-1,Galen Collection ,Homelegance,"Providing flexible options to fit any size bedroom is the Galen Collection. This transitional bedroom group is featured in a white finish making it an appropriate choice for a number of youth bedroom settings. With twin over full, twin over twin, full over full configurations - along the newly available captains bed, with trundle that features two drawers, and twin/twin bunk with storage stair steps - the design allows you to choose the size that is right for your family. Two under bed options are available for the bunk beds - toy boxes that provide additional storage space or twin trundle that offers additional sleep space.",youth,https://s3-us-west-1.amazonaws.com/homelegance-resized/Images_MidRes_For+Customer+Advertisement/B2053PRW-1_open.jpg
2049F-1,Gavino Collection ,Homelegance,"The Gavino Collection is styled for the modern bedroom, utilizing minimalistic design elements to create a unique look. Gray metal framing provides contrast to the brown fabric inserts of the headboard and footboard.",youth,https://s3-us-west-1.amazonaws.com/homelegance-resized/Images_MidRes_For+Customer+Advertisement/2049F-1.jpg
2050F-1,Jayla Collection ,Homelegance,"Modern traditional styling is utilized to create the design of the Jayla Collection. Black metal framing is perfectly contrasted by the brown bi-cast vinyl button-tufted inserts of the headboard and footboard, creating a unique look for your bedroom. The collection is offered in twin and full size beds.",youth,https://s3-us-west-1.amazonaws.com/homelegance-resized/Images_MidRes_For+Customer+Advertisement/2050F-1.jpg
4966BR,Tulney Collection ,Homelegance,"The Tulney Collection is designed with the modern traditional home in mind. Designed to use as a bed or a cozy relaxation nook, it features a trundle that provides the extra space that you need for overnight guests. Covered in a neutral toned gray fabric, the black button-tufted back panel, and the nailhead accent along the curved arm panels complete the traditional look. Also available in brown and dark gray fabric.",youth,https://s3-us-west-1.amazonaws.com/homelegance-resized/Images_MidRes_For+Customer+Advertisement/4966BR.jpg
2243-1,Deryn Park Collection ,Homelegance,"Walking into the bedroom that is occupied by the Deryn Park Collection immediately displays your love of the traditional aesthetic. Stately from every angle, sophisticated design elements blend to create this beautiful collection. With two bed options – A graceful sleigh bed or stately poster bed– the collection allows you the flexibility to fit the scale of your bedroom and the design to accommodate your personal style. Design elements include burl inlay, traditional bale and knob hardware, claw feet and shell motifs. The cherry finish is highlighted by gold tipping that accentuates the traditional feel of elegant Deryn Park Collection.",bedroom,https://s3-us-west-1.amazonaws.com/homelegance-resized/Images_MidRes_For+Customer+Advertisement/2243-1.jpg
3257RF-30,Carrier Collection ,Homelegance,"Designed for placement in a number of living room settings, the Carrier Collection is a functional and stylish addition to your home. The cocktail-s tabletop lifts to extend to your seated position and is supported by casters for ease of movement, the end table and chairside table feature a functional drawer. All three pieces in the collection feature lower display shelving. An dark espresso finish further lends to the look of this versatile occasional grouping.",occasional,https://s3-us-west-1.amazonaws.com/homelegance-resized/Images_MidRes_For+Customer+Advertisement/3257RF-30.jpg
3588-30,Sikeston Collection ,Homelegance,"With a design that is refined in its simplicity, the Sikeston Collection will be an elegant addition to your living room. A warm cherry finish is utilized to highlight the book match veneers that grace each tabletop. Clipped corners provide a decorative touch, the lower display shelves allow for placement of your prized possessions and casters provide functionality with ease of movement of the cocktail table.",occasional,https://s3-us-west-1.amazonaws.com/homelegance-resized/Images_MidRes_For+Customer+Advertisement/3588-30.jpg
5430-30,Miami Collection ,Homelegance,Ultra-modern styling is achieved in the design of the Miami Collection. High gloss dark grey tabletops feature chrome legs that exemplify the tenants of contemporary interior design.,occasional,https://s3-us-west-1.amazonaws.com/homelegance-resized/Images_MidRes_For+Customer+Advertisement/5430-30 5430-04.jpg
2147T-1,Mayville Collection ,Homelegance,"Traditional in design and modest in scale, the elegant Mayville Collection takes its design inspiration from the classic Louis Philippe styling. Featuring four distinct finishes – burnished brown cherry, white, black, and the newly offered stained grey – with all of the traditional flare unique to the style – antiqued metal bale hardware and distinct framing – this collection is a perfect addition to your traditional adult or youth bedroom.",youth,https://s3-us-west-1.amazonaws.com/homelegance-resized/Images_MidRes_For+Customer+Advertisement/2147T.jpg
1356TPRW-T,Morelle Collection ,Homelegance,The warmth of cottage living is invoked by the classic styling of the adult and youth Morelle Collection. The low post bed features picture framing and round finials with the case pieces featuring molded drawer fronts and knob hardware. The newly offered cherry finish offers an additional option to the classic black and white finishes that are currently available.,youth,https://s3-us-west-1.amazonaws.com/homelegance-resized/Images_MidRes_For+Customer+Advertisement/1356TPRW-1T.jpg
5267RF-30,Reid Collection ,Homelegance,"A classic look for your traditional home, the Reid Collection offers an updated country style that will be a warm and inviting addition to your living room. A cherry finish graces the wood veneer of the group. Each table in the collection supported by substantially appointed turned legs while functional drawers on each piece and casters on the cocktail table provide for storage and convenient movement.",occasional,https://s3-us-west-1.amazonaws.com/homelegance-resized/Images_MidRes_For+Customer+Advertisement/5267RF-30.jpg
4962DB-NT,Ruby Collection ,Homelegance,"The multi-functionality of a daybed provides a level of flexibility that makes it a welcome addition to almost any home. The Ruby Collection is finished in burnished bronze and is a sturdy in traditional styling. When used as a bed, with the addition of the trundle, your sleep space capability doubles.",youth,https://s3-us-west-1.amazonaws.com/homelegance-resized/Images_MidRes_For+Customer+Advertisement/4962DB-NT.jpg
5873N-BH,Elista Collection ,Homelegance, ,home,https://s3-us-west-1.amazonaws.com/homelegance-resized/Images_MidRes_For+Customer+Advertisement/5873N-BH.jpg
B2013PRDC-1,Rowe Collection ,Homelegance,"Maximizing sleep space is achieved with the stylish Rowe Collection. This transitional bedroom group is featured in a dark cherry finish making it an appropriate choice for a number of youth bedroom settings. With twin over full, twin over twin, full over full configurations - along the newly available captains bed, with trundle that features two drawers, and twin/twin bunk with storage stair steps - the design allows you to choose the size that is right for your family. Two under bed options are available for the bunk beds - toy boxes that provide additional storage space or twin trundle that offers additional sleep space.",youth,https://s3-us-west-1.amazonaws.com/homelegance-resized/Images_MidRes_For+Customer+Advertisement/B2013PRDC-1_open.jpg
4603PU,Tigard Collection ,Homelegance,"With a clean transitional style, the functional storage ottoman of the Tigard Collection will provide the extra storage or seating space that your home needs. The track-style side supports buffer the tufted lift top of the unit, which opens to reveal the storage space below. When closed, the unit can function as additional seating or as an occasional piece. Covered in a fashionable brown bi-cast vinyl, makes this unit a perfect fit in many home decors.",occasional,https://s3-us-west-1.amazonaws.com/homelegance-resized/Images_MidRes_For+Customer+Advertisement/4603PU.jpg
468CP,Kaitlyn Collection ,Homelegance,Functional cocktail ottoman with casters features storage and seating that reverse to reveal up to four individual serving trays.,occasional,https://s3-us-west-1.amazonaws.com/homelegance-resized/Images_MidRes_For+Customer+Advertisement/468CP.jpg
3219PU-01,Brussel Collection ,Homelegance,"Perfect for apartment and smaller living spaces, this stylish, espresso finished, contemporary occasional group features clean lines, a glass top, and wedge seating that fits perfectly under the tabletop for those who desire a streamlined look. Three cocktail table options allow for extra seating or accessory display. The seat of pie-shaped ottoman and stool is covered in dark brown bi-cast vinyl.",occasional,https://s3-us-west-1.amazonaws.com/homelegance-resized/Images_MidRes_For+Customer+Advertisement/3219PU-01.jpg
4507-F2,Destry Collection ,Homelegance,"With a base that lends to a modern look and seat that has design roots that lean towards a more traditional styling, the Destry Collection will be a versatile choice for your home. The continuous frame of the black metal base supports the button tufted fabric seat. Offered in dark gray and beige for the perfect pairing to your home décor.",home,https://s3-us-west-1.amazonaws.com/homelegance-resized/Images_MidRes_For+Customer+Advertisement/4507-F2.jpg
4500-F1,Cleo Collection ,Homelegance, ,home,https://s3-us-west-1.amazonaws.com/homelegance-resized/Images_MidRes_For+Customer+Advertisement/4500-F1.jpg
5556-30,Cavendish Collection ,Homelegance,Generous curves and a warm cherry finish enhance the traditional look of the Cavendish Collection. Carved egg and dart molding accent the apron and glass insert provides a view onto the display shelves.,occasional,https://s3-us-west-1.amazonaws.com/homelegance-resized/Images_MidRes_For+Customer+Advertisement/5556-30.jpg
5512-31,Sage Collection ,Homelegance,"Burnished wood tabletops sit atop modern-industrial framing in the Sage Collection. Packaged as a three piece occasional table group, the cocktail and two end tables provide a distinct look as well as the tabletop space you need for your living room.",occasional,https://s3-us-west-1.amazonaws.com/homelegance-resized/Images_MidRes_For+Customer+Advertisement/5512-31.jpg
4692-13,Bingsley Collection ,Homelegance,Danish mid-century modern design is infused in the style platform of the Bingsley Collection decorative ottoman bench that also served as additional seating. Wood framing features the expected delicate tapering of the legs classic to this style and provides an elegant contrast to the dark grey tone of the button-tufted fabric seat.,home,https://s3-us-west-1.amazonaws.com/homelegance-resized/Images_MidRes_For+Customer+Advertisement/4692-13.jpg
