number,name,brand,description,category,image
4967BK-NT,Octavia Collection ,Homelegance,"With a look that lends to sophisticated urban styling, the Octavia Collection will be a welcome addition to your home. Gray fabric-covered inserts feature button detailing along with distinct black metal framing to achieve the modern look of the daybed. A metal frame trundle glides from beneath the main sleeping platform to provide additional sleep space.",youth,https://s3-us-west-1.amazonaws.com/homelegance-resized/Images_MidRes_For+Customer+Advertisement/4967BK-NT.jpg
4965W-NT,Lorena Collection ,Homelegance,"Classically styled for your traditional home, the Lorena Collection is offered in a white finish with accenting finials and turned metal connectors that complete the look of this daybed. The metal trundle provides additional sleep space to fit your needs.",youth,https://s3-us-west-1.amazonaws.com/homelegance-resized/Images_MidRes_For+Customer+Advertisement/4965W-NT.jpg
4966,Tulney Collection ,Homelegance,"The Tulney Collection is designed with the modern traditional home in mind. Designed to use as a bed or a cozy relaxation nook, it features a trundle that provides the extra space that you need for overnight guests. Covered in a neutral toned grey fabric, the black button-tufted back panel, and the nailhead accent along the curved arm panels complete the traditional look.",youth,https://s3-us-west-1.amazonaws.com/homelegance-resized/Images_MidRes_For+Customer+Advertisement/4966.jpg
4969GY,Therese Collection ,Homelegance,"The gray fabric covering of the Therese Collection blended with nailhead accent and clean lines, creates a look that will compliment your home decor. Whether used for sleeping or relaxing, the clean-line daybed design allows for placement in a number of room sizes and configurations, while the under-bed trundle pulls out to accommodate your additional sleep space needs.",youth,https://s3-us-west-1.amazonaws.com/homelegance-resized/Images_MidRes_For+Customer+Advertisement/4969GY.jpg
4968BK-NT,Auberon Collection ,Homelegance,"Modern traditional styling plays well with the décor of your home in the Auberon Collection. Quatrefoil pattern is, along with distinct jointing, as a decorative statement with the black metal framing serving as an update to the traditional look. A metal frame trundle glides from beneath the main sleeping platform to provide additional sleep space.",youth,https://s3-us-west-1.amazonaws.com/homelegance-resized/Images_MidRes_For+Customer+Advertisement/4968BK-NT.jpg
4949BK,Adra Collection ,Homelegance,"The black vinyl covering of the Adra Collection blended with clean contemporary lines, creates a look that will compliment your home's decor. Whether used for sleeping or relaxing, the clean-line trundle design allows for placement in a number of room sizes and configurations, while the under-bed trundle pulls out to accommodate your additional sleep space needs.",youth,https://s3-us-west-1.amazonaws.com/homelegance-resized/Images_MidRes_For+Customer+Advertisement/4949BK.jpg
2025T-1HB,Potrero Collection ,Homelegance,"Versatile placement options, while utilizing minimum space makes the Potrero Collection the right choice for your home. Three styles, each offered in a single cover are available - Grey fabric with vertical channel seaming, black bi-cast vinyl with x-stitch pattern and brown fabric with square pattern.",youth,https://s3-us-west-1.amazonaws.com/homelegance-resized/Images_MidRes_For+Customer+Advertisement/2025T-1HB.jpg
8327BLK-3,Deryn Collection ,Homelegance,"Mid-Century modern design is the inspiration for the Deryn Collection. Wide, dramatically curved arms rise to the straight back that is synonymous with this classic style. Contrast toss pillows and an additional chair option are featured in a modern teal or gray herringbone pattern to complement the teal fabric, beige fabric and gray fabric seating body covers. Tailored stitch tufting lends further accent to this thoroughly modern collection. The collection is also available in chair, love seat, sofa and sectional covered with red or black leather gel match.",seating,https://s3-us-west-1.amazonaws.com/homelegance-resized/Images_MidRes_For+Customer+Advertisement/8327BLK.jpg
2952-30,Halston Collection ,Homelegance,Extraordinary contemporary design is utilized in the creation of the Halston Collection. Streamlined table legs extend and intersect to support the glass tabletops in this unique occasional table offering. The espresso finish of the wood legs furthers the modern feel of the collection.,occasional,https://s3-us-west-1.amazonaws.com/homelegance-resized/Images_MidRes_For+Customer+Advertisement/2952-30.jpg
4950,Roland Collection ,Homelegance,"With a modern design that includes clean lines and a dark brown bi-cast vinyl or modern grey fabric, the Roland Collection will be a functional addition to your home. Nestled below the twin bed is the easily accessed lower trundle unit. Casters make quick work of extending this extra sleep space.",youth,https://s3-us-west-1.amazonaws.com/homelegance-resized/Images_MidRes_For+Customer+Advertisement/4950+Shoot+1.jpg
4960DB-NT,Courtney Collection ,Homelegance,"The multi-functionality of a daybed provides a level of flexibility that makes it a welcome addition to almost any home. The Courtney Collection is finished in black and features the design accent of whimsical swirls. When used as a bed, with the addition of the trundle, your sleep space capability doubles.",youth,https://s3-us-west-1.amazonaws.com/homelegance-resized/Images_MidRes_For+Customer+Advertisement/4960DB-NT.jpg
5400-30,Schleiger Collection ,Homelegance,"Transitionally styled with a burnished brown finish, the Schleiger Collection features bold accenting for your living room. Sturdy legs support the metal and rivet banded table tops of the cocktail table, sofa table and end table.",occasional,https://s3-us-west-1.amazonaws.com/homelegance-resized/Images_MidRes_For+Customer+Advertisement/5400-30.jpg
4950GY,Roland Collection ,Homelegance,"With a modern design that includes clean lines and a dark brown bi-cast vinyl or modern grey fabric, the Roland Collection will be a functional addition to your home. Nestled below the twin bed is the easily accessed lower trundle unit. Casters make quick work of extending this extra sleep space.",youth,https://s3-us-west-1.amazonaws.com/homelegance-resized/Images_MidRes_For+Customer+Advertisement/4950GY.jpg
1828-1,Chambord Collection ,Homelegance,"Modern elegance takes form in the Chambord Collection. Immediately catching your eye is the striking champagne gold finish, an opulent mix of silver and gold hues, elegantly accented by the faux silk fabric and gold brushed hardware that is featured on select pieces of the collection.  The serpentine-fronted case pieces are adorned with canted pilasters featuring overlay fretwork, scalloped bases and a delicately splayed cabriole leg. Further lending to the lavish look of the collection is the faux silk rolled, button-tufted bed. The low profile footboard allows for an unrestricted view of the magnificent headboard.",bedroom,https://s3-us-west-1.amazonaws.com/homelegance-resized/Images_MidRes_For+Customer+Advertisement/1828-1.jpg
3526-30,Mariacarla Collection ,Homelegance,Blending elements of traditional design creates the classic look of the Mariacarla Collection. Genuine marble table tops perch atop acanthus leaf relief-enhanced cabriole legs in this occasional table offering. The dark cherry leg finish of the collection serves to highlight not only the traditional style but the marble as well.,occasional,https://s3-us-west-1.amazonaws.com/homelegance-resized/Images_MidRes_For+Customer+Advertisement/3526-30.jpg
5469-30,Chama Collection ,Homelegance,"A complement to the modern or transitional home, the Chama Collection is a unique addition to the overall décor of your home's living room. Framed in metal with a faux wood veneer top, the circular patterns provide focal accent to the cocktail and end table bases, ultimately lending to the flexibility for placement in a number of casual living room settings.",occasional,https://s3-us-west-1.amazonaws.com/homelegance-resized/Images_MidRes_For+Customer+Advertisement/5469-30.jpg
3216B-31,Zen Collection ,Homelegance,This great contemporary three-piece occasional group features a tray top design in espresso finish. Matching sofa table is also offered in Zen collection.,occasional,https://s3-us-west-1.amazonaws.com/homelegance-resized/Images_MidRes_For+Customer+Advertisement/3216B-31.jpg
B2053FFW-1,Galen Collection ,Homelegance,"Providing flexible options to fit any size bedroom is the Galen Collection. This transitional bedroom group is featured in a white finish making it an appropriate choice for a number of youth bedroom settings. With twin over full, twin over twin, full over full configurations - along the newly available captains bed, with trundle that features two drawers, and twin/twin bunk with storage stair steps - the design allows you to choose the size that is right for your family. Two under bed options are available for the bunk beds - toy boxes that provide additional storage space or twin trundle that offers additional sleep space.",youth,https://s3-us-west-1.amazonaws.com/homelegance-resized/Images_MidRes_For+Customer+Advertisement/B2053FFW-1.jpg
8412-30,Fiorella Collection ,Homelegance,"The elaborate designs of Old World Europe are treated with a distinct modern touch in the Florentina Collection. The marble topped tables feature a delicate grey hue that accents the silver, with gold undertone finish of the wood base. With details such as shell and acanthus leaf scrolling and cabriole legs, the traditional look of the collection is solidified.",occasional,https://s3-us-west-1.amazonaws.com/homelegance-resized/Images_MidRes_For+Customer+Advertisement/8412-30 8412-04.jpg
8079-30,Santos Collection ,Homelegance,"Blending the elements of Craftsman styling, industrial design, and natural wood tones to achieve the unique look of the Santos Collection. The design of this occasional offering is enhanced by distressing its solid rubberwood table tops, which cover in natural brown finish allowing for the grain to capture one-s eye. Staple accenting on the table's edge hints at a rough-hewn industrial look that has been softened for your living room.",occasional,https://s3-us-west-1.amazonaws.com/homelegance-resized/Images_MidRes_For+Customer+Advertisement/8079-30.jpg
5428-30,Anna Claire Collection ,Homelegance,"Creating a unique style that blends femininity with gracefully weathered industrial accenting, the Anna Claire Collection provides an unexpectedly elegant addition to a number of living spaces. A driftwood finish covers the wood of the bases that support the rusticated zinc tabletops. Nail head accent table banding adds to the creative look of the collection.",occasional,https://s3-us-west-1.amazonaws.com/homelegance-resized/Images_MidRes_For+Customer+Advertisement/5428-30.jpg
5177-30,Beaugrand Collection ,Homelegance,"With leaning towards the styles of industrial, contemporary and transitional, the Beaugrand will be an appropriate choice for a number of living room decors. The sofa table, end table, and cocktail table feature decorative metal banding and are supported by a modified X-base pedestal.",occasional,https://s3-us-west-1.amazonaws.com/homelegance-resized/Images_MidRes_For+Customer+Advertisement/5177-30.jpg
3205-30,Chorus Collection ,Homelegance, ,occasional,https://s3-us-west-1.amazonaws.com/homelegance-resized/Images_MidRes_For+Customer+Advertisement/3205-30.jpg
3226-30,Mooney Collection ,Homelegance,"In a unique turn of design, the Schmid Collection features off-set table bases in a rich dark cherry finish that perfectly complements the cool creamy tone of the faux marble tabletops. Each base features a display shelf, providing you the extra space to show off your prized possessions.",occasional,https://s3-us-west-1.amazonaws.com/homelegance-resized/Images_MidRes_For+Customer+Advertisement/9712BE _3226-30.jpg
1288-301,Ella Martin Collection ,Homelegance,"When adding the personal touches to your living space that reflect the warmth and elegance of your home, the Ella Martin Collection is the perfect traditional table offering. Featuring a warm brown cherry finish, smoked glass, and gold tipped acanthus leaf motif.",occasional,https://s3-us-west-1.amazonaws.com/homelegance-resized/Images_MidRes_For+Customer+Advertisement/1288-301.jpg
3533-30,Tioga Collection ,Homelegance,"Designed for the modern home, the Tioga Collection will provide a unique look for your living room. Brushed chrome geometric support legs provide a distinct contrast to the espresso finish of the table tops and display shelves in this occasional grouping. Drawers provide additional storage space while the functionality of the collection is further enhanced by the lift mechanism that allows for the extension of the cocktail table's top.",occasional,https://s3-us-west-1.amazonaws.com/homelegance-resized/Images_MidRes_For+Customer+Advertisement/3533-30.jpg
3224N-05,Daria Collection,Homelegance,"A continuous metal frame comprises the support system in the rustic Daria Collection. Each piece features wood shelving, with hints of grey within the finish, lending distinct character. Bookcase is offered in two widths, 26-inch and 40- inch wide, for the perfect placement in your home.",occasional,https://s3-us-west-1.amazonaws.com/homelegance-resized/Images_MidRes_For+Customer+Advertisement/3224N.jpg
3587-30,Lovington Collection ,Homelegance,"Turned legs provide support to the tabletops and display shelves of the Lovington Collection. Modern traditional styling is achieved with a blend of classic accents - turned legs, knob hardware, espresso finish, and creative functionality - caster-supported lift-top cocktail table, end table with drawer. Each of these elements combines to create a stylish look for your home's living room.",occasional,https://s3-us-west-1.amazonaws.com/homelegance-resized/Images_MidRes_For+Customer+Advertisement/3587-30.jpg
3401W-30,Firth II Collection ,Homelegance,Intersecting deep cherry finished wood ovals are set atop rounded wooden bases and serve to support beveled glass tops in the Firth II Collection. Add a touch of quality and contemporary style to your home with this sleek design which melds glass and wood into a classic contemporary design.,occasional,https://s3-us-west-1.amazonaws.com/homelegance-resized/Images_MidRes_For+Customer+Advertisement/3401W-30.jpg
3508-30,Pierre Collection ,Homelegance,Oval table tops are supported by elegantly curved legs in the Pierre Collection. The rich espresso finish is complemented by the glass insert table tops. Lower shelving provides a platform to display your prized possessions.,occasional,https://s3-us-west-1.amazonaws.com/homelegance-resized/Images_MidRes_For+Customer+Advertisement/3508-30.jpg
17809,Alouette Collection ,Homelegance,"Like a window into your design world, the Alouette Collection provides a classic, yet modern platform for your living room experience. The cocktail and end table feature square tabletops with glass supports that are connected by metal hardware.",occasional,https://s3-us-west-1.amazonaws.com/homelegance-resized/Images_MidRes_For+Customer+Advertisement/17809.jpg
3292-01,Brussel II Collection ,Homelegance,"Extra seating is never a problem with the functional Brussel II Collection. The four stools, with dark brown bi-cast vinyl seat cover, tuck neatly under the cocktail table when not in use. The geometric circular design and warm brown cherry finish will be a perfect addition to any home décor.",occasional,https://s3-us-west-1.amazonaws.com/homelegance-resized/Images_MidRes_For+Customer+Advertisement/3292-01.jpg
5516-66,Janina Collection ,Homelegance,"At home in a casual country setting, the Janina Collection allows for a customizable look to match the décor of your dining space. The natural finish of the pine veneer serves to contrast the 4 available colors – teal, black, white, buttermilk – and allowing for an eclectic mix and match combination or singular color configuration.",dining,https://s3-us-west-1.amazonaws.com/homelegance-resized/Images_MidRes_For+Customer+Advertisement/5516-66 5516BKS 5516BMS 5516TLS 5516WTS.jpg
8334DBR-3,Oriole Collection ,Homelegance,"At home in transitional to contemporary settings, the Oriole will be a welcome addition to your living room. The black AireHyde match cover is utilized for comfort and durability. Ample seating creates a plush platform for your relaxation, with each piece in the collection offering unique functionality. The dual reclining sofa features a drop-down center seatback that opens to reveal a table top and cup holders. Glider reclining mechanisms provide additional comfort on the love seat with center console unit. The Chair completes the seating collection with swivel and glider reclining function.",seating,https://s3-us-west-1.amazonaws.com/homelegance-resized/Images_MidRes_For+Customer+Advertisement/8334DBR.jpg
4602PU,Reverie Collection ,Homelegance,"Adding a touch of glamour to your home is the Reverie Collection. Black bi-cast vinyl covers this stylish ottoman. The attached top opens to reveal ample storage space. Polished nailhead accent trim encircles the base of the unit, providing a sophisticated touch.",occasional,https://s3-us-west-1.amazonaws.com/homelegance-resized/Images_MidRes_For+Customer+Advertisement/4602PU.jpg
3604-31,Olas Collection ,Homelegance,Completing the contemporary vision you seek to create in your living space is the Olas Collection. Minimalistic black metal framing is utilized as a support for glass tabletops in this modern occasional 3-piece offering.,occasional,https://s3-us-west-1.amazonaws.com/homelegance-resized/Images_MidRes_For+Customer+Advertisement/3604-31.jpg
4723,Ladd Collection ,Homelegance, ,occasional,https://s3-us-west-1.amazonaws.com/homelegance-resized/Images_MidRes_For+Customer+Advertisement/4723.jpg
3605-31,Suisun Collection ,Homelegance,Subtle convex dark metal framing provides support to the glass table tops of the Suisun Collection. Matching end tables accompany the cocktail table of this modern 3-piece occasional table group.,occasional,https://s3-us-west-1.amazonaws.com/homelegance-resized/Images_MidRes_For+Customer+Advertisement/3605-31.jpg
8235SS-3,Breaux Collection ,Homelegance,"Contemporary design is utilized to create the look of the Breaux Collection. The collection is offered in gray or sesame cover for ultimate design versatility, with two configurations – sofa with end chaise or traditional sofa, love seat and chair – allowing for perfect placement within your living room. Reversible back cushions further the functionality and chrome legs support and lend to the modern design.",seating,https://s3-us-west-1.amazonaws.com/homelegance-resized/Images_MidRes_For+Customer+Advertisement/8235SS.jpg
4741FA,Colusa Collection ,Homelegance,"Additional storage space is always welcome in any home. The Colusa Collection will provide you with the extra room you need to store your personal items. Covered in a neutral grey fabric, this transitionally designed ottoman will place perfectly in a number of home decors. Button tufting lends a stylish touch to the piece.",occasional,https://s3-us-west-1.amazonaws.com/homelegance-resized/Images_MidRes_For+Customer+Advertisement/4741FA.jpg
8219-30,Veloce Collection ,Homelegance, ,occasional,https://s3-us-west-1.amazonaws.com/homelegance-resized/Images_MidRes_For+Customer+Advertisement/8219-30.jpg
3561-31,Vasily Collection ,Homelegance,"Mid-century modern design provides inspiration in the Vasily Collection. Cherry finished wood legs are joined by an inner, high-polished chrome ring and rise to support the glass tops in this three-piece occasional table offering. Included are two round end tables and one oval cocktail table.",occasional,https://s3-us-west-1.amazonaws.com/homelegance-resized/Images_MidRes_For+Customer+Advertisement/3561-31.jpg
3224N-16,Daria Collection ,Homelegance, ,occasional,https://s3-us-west-1.amazonaws.com/homelegance-resized/Images_MidRes_For+Customer+Advertisement/3224N-16.jpg
8324-4,Radley Collection ,Homelegance,"Refined for placement in the most traditional of homes, yet inviting enough for more casual settings, the turned legs ottoman of Radley Collection will be a statement to your preference for classic style.",occasional,https://s3-us-west-1.amazonaws.com/homelegance-resized/Images_MidRes_For+Customer+Advertisement/8324-4.jpg
3224N-17,Daria Collection ,Homelegance, ,occasional,https://s3-us-west-1.amazonaws.com/homelegance-resized/Images_MidRes_For+Customer+Advertisement/3224N-17.jpg
4501-F2,Tala Collection ,Homelegance,"A bold statement for any room the Tala Collection provides function and style for your living space. Offered in dark blue and brown, each piece is boldly accented with a white quatrefoil pattern. The attached lift top allows for discrete storage space within your home.",home,https://s3-us-west-1.amazonaws.com/homelegance-resized/Images_MidRes_For+Customer+Advertisement/4501-F2.jpg
4500-F2,Cleo Collection ,Homelegance, ,home,https://s3-us-west-1.amazonaws.com/homelegance-resized/Images_MidRes_For+Customer+Advertisement/4500-F2.jpg
8337FA-3,Temptation Collection ,Homelegance, ,home,https://s3-us-west-1.amazonaws.com/homelegance-resized/Images_MidRes_For+Customer+Advertisement/8337FA-3 8337FA-4.jpg
5415RF-FBH,Sedley Collection ,Homelegance, ,home,https://s3-us-west-1.amazonaws.com/homelegance-resized/Images_MidRes_For+Customer+Advertisement/5415RF-FBH_open.jpg
4501-F1,Tala Collection ,Homelegance,"A bold statement for any room the Tala Collection provides function and style for your living space. Offered in dark blue and brown, each piece is boldly accented with a white quatrefoil pattern. The attached lift top allows for discrete storage space within your home.",home,https://s3-us-west-1.amazonaws.com/homelegance-resized/Images_MidRes_For+Customer+Advertisement/4501-F1.jpg
4500-F3,Cleo Collection ,Homelegance,Â ,home,https://s3-us-west-1.amazonaws.com/homelegance-resized/Images_MidRes_For+Customer+Advertisement/4500-F3.jpg
1212F4S,Langdale Collection ,Homelegance,"A tasteful accent to any room in your home is the Langdale Collection. The tufted fan back serves as the focal point, while dark cherry finish, on the wood legs, makes for a perfect contrast against either the oatmeal linen, french note, or grey chevron fabric offerings.",home,https://s3-us-west-1.amazonaws.com/homelegance-resized/Images_MidRes_For+Customer+Advertisement/1212F4S.jpg
1192BL,Lucille Collection ,Homelegance,"Retro lines need not stay in the past with the mid-century inspired lines of the Lucille Collection. With fabric offerings that range from neutral to bold such as beige, gray, blue, and orange further complemented with button-tufted accenting and stylishly appointed legs, this classic accent chair will provide a look that shows your personal style.",home,https://s3-us-west-1.amazonaws.com/homelegance-resized/Images_MidRes_For+Customer+Advertisement/1192BL.jpg
8234TT-3,Grande Isle Collection ,Homelegance,Your traditional home will be perfectly outfitted with the addition of the Grande Isle Collection. The show wood frame defines the profile of the collection while the two available cover options - Brown fabric with bi-cast vinyl accent or red print fabric – lend further traditional emphasis. Contrast toss pillows complete the look.,seating,https://s3-us-west-1.amazonaws.com/homelegance-resized/Images_MidRes_For+Customer+Advertisement/8234TT.jpg
4506PU,Qirin Collection ,Homelegance,"Mottled coloring provides realistic enhancement to the alligator embossed bi-cast vinyl seat of the Nestor Collection. Supported by a chrome base, this modern accent bench is a glamorous addition to your home's décor.",home,https://s3-us-west-1.amazonaws.com/homelegance-resized/Images_MidRes_For+Customer+Advertisement/4506PU.jpg
5873N-ST,Elista Collection ,Homelegance, ,home,https://s3-us-west-1.amazonaws.com/homelegance-resized/Images_MidRes_For+Customer+Advertisement/5873N-ST.jpg
4502FA,Qirin Collection ,Homelegance,"Designed with a traditional touch and a nod towards modern classicism, the Qirin Collection accent bench is a gorgeous option for your home. A sturdy metal frame design is supported with subtle distressed white finish covers the turned legs and is elegantly accented by the bluish gray, button-tufted seat.",home,https://s3-us-west-1.amazonaws.com/homelegance-resized/Images_MidRes_For+Customer+Advertisement/4502FA.jpg
4614-F1,Fedora Collection ,Homelegance,Providing a stylish and function addition to your home is the Fedora Collection. Designed for placement in a number of settings the top opens to reveal ample storage for your personal items. The ottoman is offered in the neutral tones of grey or brown for further decorative flexibility.,home,https://s3-us-west-1.amazonaws.com/homelegance-resized/Images_MidRes_For+Customer+Advertisement/4614-F1.jpg
3224N-17,Daria Collection ,Homelegance, ,home,https://s3-us-west-1.amazonaws.com/homelegance-resized/Images_MidRes_For+Customer+Advertisement/3224N-17.jpg
1270F1S,Arles Collection ,Homelegance,"The slender-back profile of the Arles Collection gracefully gives way to the ample seat of this modern-traditional accent chair. High polish nail head accenting provides perfect contrast to the bold-hued coverings that are offered - blue, orange, and grey.",home,https://s3-us-west-1.amazonaws.com/homelegance-resized/Images_MidRes_For+Customer+Advertisement/1270F1S.jpg
