number,name,brand,description,category,image
2259GY-1,Bethel Collection ,Homelegance,"An updated classic addition to your transitional bedroom will be the Bethel Collection. Traditional accents, such as, turned bun feet that support each piece, and a gray, lightly wire-brushed finish on birch veneer and selected hardwoods, blend with framing and lines that compliment your personal style. Hidden drawer storages in the night stand and dresser are a clever way to hide your valuables.",bedroom,https://s3-us-west-1.amazonaws.com/homelegance-resized/Images_MidRes_For+Customer+Advertisement/2259GY-1.jpg
1883N-1,Wade Collection ,Homelegance,"Drawing inspiration from traditional Danish modern design, the neutral grey tone of the Wade Collection lends to the contemporary feel. The low-profile bed features a button-tufted shelter headboard.",bedroom,https://s3-us-west-1.amazonaws.com/homelegance-resized/Images_MidRes_For+Customer+Advertisement/1883N-1.jpg
2425-36,Griffin Collection ,Homelegance,The transitional design of the five-piece Griffin Collection allows for versatile placement in a number of casual dining settings. The wide ladder back chairs feature black bi-cast vinyl seating that compliments the heavily burnished finish of this 40” fixed-top counter height table.,dining,https://s3-us-west-1.amazonaws.com/homelegance-resized/Images_MidRes_For+Customer+Advertisement/2425-36.jpg
5447-29FAS,Bayshore Collection ,Homelegance, ,dining,https://s3-us-west-1.amazonaws.com/homelegance-resized/Images_MidRes_For+Customer+Advertisement/5447-24FAS 5447-29FAS.jpg
5873N-1,Elista Collection ,Homelegance,Modern styling combined with the look of tailored menswear creates a uniquely appointed offering for your bedroom in the Elista Collection. Dark gray tweed fabric is interwoven to create eye-catching drama on the headboard and footboard. The collection also features a coordinating bench and stool.,bedroom,https://s3-us-west-1.amazonaws.com/homelegance-resized/Images_MidRes_For+Customer+Advertisement/5873N-1.jpg
1140E-24S,Swivel Counter Height Chair Edmond Collection ,Homelegance, ,dining,https://s3-us-west-1.amazonaws.com/homelegance-resized/Images_MidRes_For+Customer+Advertisement/1140E-24S & 1140E-29S.jpg
5473-103,Lordsburg Collection ,Homelegance,Elegantly designed for the traditional dining room is the Lordsburg Collection. Supported by the double pedestal base is the table’s top where the magnificent parquet veneer is highlighted by the brown cherry finish that covers the collection. Heavily carved molding provides distinct accent to the table’s top while dark brown faux leather covers the seats and backs of the coordinating wood-framed chairs. The accompanying hutch and buffet provide ample storage space for your tabletop accessories.,dining,https://s3-us-west-1.amazonaws.com/homelegance-resized/Images_MidRes_For+Customer+Advertisement/5473-103.jpg
1968-1,Branton Collection ,Homelegance,The rustic modern look of the Branton Collection is a unique choice for your bedroom. An antique brown finish highlights the pine veneer while the black base rails that support the collection provide subtle contrast for a rustic industrial look. Unfettered framing allows for the veneer pattern to provide decorative accent. Horizontal hardware accents each case piece.,bedroom,https://s3-us-west-1.amazonaws.com/homelegance-resized/Images_MidRes_For+Customer+Advertisement/1968.jpg
5177-84,Beaugrand Collection ,Homelegance,"Leaning towards the styles of industrial, contemporary and transitional, the Beaugrand Collection will be an appropriate choice for a number of dining room decors. Offered in two table styles – round or rectangular – both options of the dining collection feature decorative stainless steel apron trim banding and modified X-base. The coordinating sling-back chair is upholstered in neutral grey fabric with brown tone, accenting by nailheads.",dining,https://s3-us-west-1.amazonaws.com/homelegance-resized/Images_MidRes_For+Customer+Advertisement/5177-84.jpg
1961-1,Erwan Collection ,Homelegance,"Taking a nod from contemporary design, the look of the Erwan Collection is a versatile choice for the modern home. A rich espresso finish highlights the okume veneer and beveled drawer fronts which are punctuated with gunmetal finished hardware and bold framing that blend together to create this soft contemporary bedroom offering.",bedroom,https://s3-us-west-1.amazonaws.com/homelegance-resized/Images_MidRes_For+Customer+Advertisement/1961-1.jpg
1946-1,Verlyn Collection ,Homelegance,"Traditional from the canopy of the four post bed to the burl drawer fronts and turned feet of the case goods, the Verlyn Collection provides an elegant addition to your bedroom space. A classic cherry finish is utilized to highlight the cherry and ash burl veneers. Knob hardware provides refined contrast to the drawer fronts, while turned feet rise to support each case piece. The metal canopy rail that encircles the bed is supported by finial-topped turned posts, lending to the grandeur of the collection.",bedroom,https://s3-us-west-1.amazonaws.com/homelegance-resized/Images_MidRes_For+Customer+Advertisement/1946.jpg
1909RF-1,Terron Collection ,Homelegance,"Redefining, soft contemporary design is achieved by blending classic elements to create the look of the Terron Collection. The bow-fronted case goods and sleigh bed feature book-matched mindy veneer that is beautifully highlighted by a medium oak finish. Off-set drawers on the dresser and the floating top design of each case pieces provides unique design character that makes this collection a perfect fit for your home.",bedroom,https://s3-us-west-1.amazonaws.com/homelegance-resized/Images_MidRes_For+Customer+Advertisement/1909RF-1.jpg
1882N-1,Bryndle Collection ,Homelegance,"The modern traditional styling of the Bryndle Collection is characterized by the button-tufted headboard and footboard, as well as the nail head accenting on headboard. Further complimenting the design is the dark grey fabric that covers.",bedroom,https://s3-us-west-1.amazonaws.com/homelegance-resized/Images_MidRes_For+Customer+Advertisement/1882N-1.jpg
1967W-1,Pell Collection ,Homelegance,"Ultra-modern from the straight lines that defines the profile to the two-tone espresso and white finish, the Pell Collection is a stylish choice for your bedroom. Bold finish contrast is rather contrasted by nickel hardware for the ultimate in contemporary accenting. Elevating the functionality of the collection is the bookcase headboard and off-set storage mirror compartment.",bedroom,https://s3-us-west-1.amazonaws.com/homelegance-resized/Images_MidRes_For+Customer+Advertisement/1967W-1.jpg
1949-1,Frederica Collection ,Homelegance,"At home in the most traditional of spaces, the Frederica Collection will provide the classic look you are seeking to add to your bedroom. The low-post bed of the group is complemented by the traditionally accented case goods. Classic bale and knob hardware front each drawer while bun feet support. A dark, burnished cherry finish furthers the traditional look of the Frederica Collection.",bedroom,https://s3-us-west-1.amazonaws.com/homelegance-resized/Images_MidRes_For+Customer+Advertisement/1949-1.jpg
1714BK-1,Laurelin Collection ,Homelegance,"Casual transitional styling lends versatility to the placement of the Laurelin Collection in a number of bedroom settings. Black and White sand-through finishes are available creating distinctly different looks from traditional to country casual, with antiqued bronze knob hardware punctuating the look of each framed drawer front. Hidden drawers in the nightstand and dresser provide discrete storage for your valuables, while the storage drawers of the footboard provide a more visible means of additional storage capability. Bun feet support the case goods and a sleigh headboard finish off the transitional design of the collection.",bedroom,https://s3-us-west-1.amazonaws.com/homelegance-resized/Images_MidRes_For+Customer+Advertisement/1714BK-1.jpg
17813,Alouette Collection ,Homelegance,"Like a window into your design world, the Alouette Collection provides a classic, yet modern platform for your dining experience. Offered in a rectangular or square top, this all glass table is a vision to behold. When accented with a traditional style wood chair upholstered in microfiber, the collection takes on an urban sophisticated look. When accented with a more modern bi-cast vinyl chair, the dining group suddenly becomes a study in contemporary design.",dining,https://s3-us-west-1.amazonaws.com/homelegance-resized/Images_MidRes_For+Customer+Advertisement/17813_2014D-148.jpg
1915-1,Anika Collection,Homelegance,"Drawing inspiration from Danish mid-century modern design, the Anika Collection is a stylish addition to your bedroom. The curved framing of each case piece is perfectly accentuated by polished chrome hardware and features soft-close mechanisms on the doors and storage drawers for quiet and sure closure. Offered alongside the traditional case pieces is a four-door chest. Ivory bi-cast vinyl covers the padded wood rail-topped headboard, providing stark contrast to the light ash finish over ash veneers. All pieces in the collection feature tapered legs that are signature to this classic look.",bedroom,https://s3-us-west-1.amazonaws.com/homelegance-resized/Images_MidRes_For+Customer+Advertisement/1915-1_9.jpg
1706-1,Moritz Collection ,Homelegance,"Taking contemporary design to a new level is the Moritz Collection. Dramatically eye-catching from the distinct veneer pattern of the faux veneer to the high-gloss sheen and chrome accents, this bedroom collection is sure to give your bedroom the modern look that you so desire. The dark smoky tone of the faux veneer is lent magnificent accenting by the silver-tone of the patterned grain. The nickel finish of the elongated vertical hardware provides complementing visual contrast.",bedroom,https://s3-us-west-1.amazonaws.com/homelegance-resized/Images_MidRes_For+Customer+Advertisement/1706-1.jpg
5797N-1,Ember Collection ,Homelegance,Light neutral toned fabric and nail head accent create a classic look that makes the Ember Collection a perfect choice for a multitude of bedroom decors.,bedroom,https://s3-us-west-1.amazonaws.com/homelegance-resized/Images_MidRes_For+Customer+Advertisement/5797N-1.jpg
1907W-1,Terrace Collection ,Homelegance, ,bedroom,https://s3-us-west-1.amazonaws.com/homelegance-resized/Images_MidRes_For+Customer+Advertisement/1907W-1.jpg
1707-1,Lavonia Collection ,Homelegance,"Transitional styling is paired with classic appointments and modern technology to create the Lavonia Collection. The eye-catching dramatic curve of the headboard creates instant appeal when taking in the design of this collection. The framing of the headboard carries over to the design of the low profile footboard and turned-foot supported recessed drawer front case pieces. Modern technology comes into play with the power strip – with USB port – charging station that is mounted to the upper back of the nightstand. A gray wire-brushed finish over oak veneers furthers the classic look of this bedroom collection.
",bedroom,https://s3-us-west-1.amazonaws.com/homelegance-resized/Images_MidRes_For+Customer+Advertisement/1707-1.jpg
1916BK-1,Allura Collection ,Homelegance,"Glamour reigns in the design of the Allura Collection. Framing each piece is a decorative beveled mirror accent that enhances the illumination from the touch-engaged LED back-light of the headboard and mirror, as well as the under-light of the night stand. Alligator embossing and high polished crystal-enhanced hardware boldly accent the available silver or black finish of the collection.",bedroom,https://s3-us-west-1.amazonaws.com/homelegance-resized/Images_MidRes_For+Customer+Advertisement/1916BK-1.jpg
1717-1,Albright Collection ,Homelegance,"Refined elegance is exemplified in the design of the Albright Collection. Classic elements of understated traditional design combined with a barnwood gray finish over oak veneer, high polish knob hardware and the light neutral tone of the fabric covered headboard and footboard, blend effortlessly to create a sophisticated modern traditional look for your bedroom. Elongated, tapered turned legs support the case pieces and bed.",bedroom,https://s3-us-west-1.amazonaws.com/homelegance-resized/Images_MidRes_For+Customer+Advertisement/1717-1.jpg
8327GY-1S,Deryn Collection ,Homelegance,"Mid-Century modern design is the inspiration for the Deryn Collection. Wide, dramatically curved arms rise to the straight back that is synonymous with this classic style. Offered as a stand-alone accent to complement your home's décor or as part of the full Deryn Collection, the chair is featured in a modern grey or teal herringbone pattern. Natural tone finished legs support the frame while tailored stitch tufting lends further accent to this thoroughly modern collection.",home,https://s3-us-west-1.amazonaws.com/homelegance-resized/Images_MidRes_For+Customer+Advertisement/8327GY 8327GY-1S.jpg
8205BR-1,Earl Collection ,Homelegance,Plush seating morphs into an enveloping relaxation platform with the pull of the manual recline mechanism in the Earl Collection. The collection is offered with a chocolate or brown covering that lends to the décor of your transitionally styled home.,seating,https://s3-us-west-1.amazonaws.com/homelegance-resized/Images_MidRes_For+Customer+Advertisement/8205BR-1.jpg
1927-1,Sorrel Collection ,Homelegance,"As a unique addition to a bedroom with either modern or rustic aesthetic, the Sorrel Collection will surely turn heads. Poplar solids feature a heavily burnished finish in this cleanly designed offering. Unfettered framing is boldly accented with two-tone exposed dovetail joints, metal pull hardware on the drawer fronts, and tapered legs that provide strong support.",bedroom,https://s3-us-west-1.amazonaws.com/homelegance-resized/Images_MidRes_For+Customer+Advertisement/1927-1.jpg
6409,Amara Collection,Homelegance,"Fun, funky and functional, the Amara Collection will provide your home with interesting conversation pieces and a look that is as unique as you are. With the turn of a crank, the adjustable table (6414) can be raised or lowered to suit your individual needs. Black iron is complimented by the bold red and white hued design of the -Atellier Loft- print that appears on the dining tabletop and carries its theme to the caster supported cocktail table (6409) - paired with our tractor seat adjustable iron barstool (6412), you will have created the creative focal point for your dining space.",home,https://s3-us-west-1.amazonaws.com/homelegance-resized/Images_MidRes_For+Customer+Advertisement/6412_high.jpg
1911-1,Granbury Collection ,Homelegance,"Classic traditional styling is updated for your home in the Granbury Collection. Design features that define this timeless look; pewter finish button and bale hardware, picture framed fronts, tapered feet, and routed pilasters play against the casual grey rub-through finish, creating a look that is both modern and stately.",bedroom,https://s3-us-west-1.amazonaws.com/homelegance-resized/Images_MidRes_For+Customer+Advertisement/1911-1.jpg
2220-1,Lorenzi Collection ,Homelegance,"The contemporary design of the Lorenzi Collection is enhanced by the addition of the durable black vinyl covering that encases each piece in the collection. Painted grey hardware provides a distinct contrast to the fabric-s finish. Scaled for urban living, this collection will prove to be a unique and stylish addition to your master, youth, and guest bedrooms.",bedroom,https://s3-us-west-1.amazonaws.com/homelegance-resized/Images_MidRes_For+Customer+Advertisement/2220.jpg
1907-1,Terrace Collection ,Homelegance,"The traditional shape and accenting of Craftsman style is perfectly achieved in the design of the Terrace Collection. A rustic burnished oak finish that accentuates the natural characteristics of the solid poplar wood lends to the design, while antiqued bronze finished hardware adorns each case piece. Drawers and door storage provide ample storage space for your personal items.",bedroom,https://s3-us-west-1.amazonaws.com/homelegance-resized/Images_MidRes_For+Customer+Advertisement/1907-1.jpg
1844DC-1,Eunice Collection ,Homelegance,Traditional aesthetic doesn-t always have to be grand in scale or accent to achieve a timeless look. The Eunice Collection takes the form of traditional case pieces and utilizes an espresso finish and understated knob hardware to create bedrooms style that can range from transitional to cottage. Recessed framing carries over from the design of the headboard to the drawer fronts of the case pieces and storage footboard.,bedroom,https://s3-us-west-1.amazonaws.com/homelegance-resized/Images_MidRes_For+Customer+Advertisement/1844DC-1.jpg
1928-1,Celandine Collection ,Homelegance,"The look of traditional design is updated for the modern traditional home in the Celandine Collection. Crystal tufting immediately draws the eyes to the pearlized finish of the bi-cast vinyl headboard insert, while high polished knob hardware stands out from the silver finish of the collection. With each of the aforementioned elements, subtle glamour will be achieved in the design of your elegant bedroom.",bedroom,https://s3-us-west-1.amazonaws.com/homelegance-resized/Images_MidRes_For+Customer+Advertisement/1928.jpg
1904,Beechnut Collection ,Homelegance,"Blending the elements of contemporary design and rustic aesthetic, the Beechnut Collection is a unique addition to your master, youth or guest bedroom. Dark under-paneling serves to highlight the light finish of the embossed faux-wood veneer of the raised panels on the bed and case goods. Contrasting cup hardware punctuates each drawer front.",bedroom,https://s3-us-west-1.amazonaws.com/homelegance-resized/Images_MidRes_For+Customer+Advertisement/1904.jpg
3551-30,Ridley Collection ,Homelegance,Industrial styling is softened by the blending of natural elements to create a stylish look in the Ridley Collection. A creamy white stone marble top is supported by the weathered wood finished base of each table - comprised of wood framing that includes display shelving with slat construction and angled supports.,occasional,https://s3-us-west-1.amazonaws.com/homelegance-resized/Images_MidRes_For+Customer+Advertisement/3551-30.jpg
1852-1,Porter Collection ,Homelegance,"With an intricate design lending to the modern look of the Porter Collection, your bedroom will reflect your taste for sophisticated contemporary living. A warm walnut finish and the look of woven detailing highlight the natural wood grain of the veneer on each piece of the collection. Knob hardware blends effortlessly to create an unobtrusive accent to the case goods. The bed features framing on the headboard and low-profile footboard that subtly incorporates the prominent woven design.",bedroom,https://s3-us-west-1.amazonaws.com/homelegance-resized/Images_MidRes_For+Customer+Advertisement/1852K-1.jpg
5789N-1,Baldwyn Collection ,Homelegance,"A rolled and tufted headboard provides elegant touches to the casual Baldwyn Collection. Offered in black bi-cast vinyl and charcoal fabric, this bed offers not only flexible placement, but the opportunity to style the room to fit your needs.",bedroom,https://s3-us-west-1.amazonaws.com/homelegance-resized/Images_MidRes_For+Customer+Advertisement/5789N Front View.jpg
1890N-1,Cadmus Collection ,Homelegance,"Offered in dark grey fabric, the Cadmus Collection tufting headboard will provide you with a versatile option for your contemporary home.",bedroom,https://s3-us-west-1.amazonaws.com/homelegance-resized/Images_MidRes_For+Customer+Advertisement/1890N-1.jpg
2026PU-1HB,Potrero Collection ,Homelegance,"Versatile placement options, while utilizing minimum space makes the Potrero Collection the right choice for your home. Three styles, each offered in a single cover are available – Grey fabric with vertical channel seaming, black bi-cast vinyl with x-stitch pattern and brown fabric with square pattern.",bedroom,https://s3-us-west-1.amazonaws.com/homelegance-resized/Images_MidRes_For+Customer+Advertisement/2026PU-1HB.jpg
1896N-1,Chasin Collection ,Homelegance,"At home in a number of room settings, the Chasin Collection is styled to fit your needs. With an unfettered design in a neutral grey tone fabric, the bed will be the perfect platform for your decorative dreams to become reality.",bedroom,https://s3-us-west-1.amazonaws.com/homelegance-resized/Images_MidRes_For+Customer+Advertisement/1896N.jpg
1834-1,Faust Collection ,Homelegance,"Modern traditional styling is utilized in the Faust Collection, making it the perfect addition to your bedroom. Traditional bun feet support each piece in the collection while the dark cherry finish further lends to the look. Dark brown bi-cast vinyl padded inserts on the headboard feature nailhead accent, while the drawer unit of the footboard provides additional storage space.  Round, antiqued bronze finished knob hardware adorns each drawer front.",bedroom,https://s3-us-west-1.amazonaws.com/homelegance-resized/Images_MidRes_For+Customer+Advertisement/1834.jpg
1831P-1,Potrero Collection ,Homelegance,"Versatile placement options, while utilizing minimum space makes the Potrero Collection the right choice for your home. Three styles, each offered in a single cover are available – Grey fabric with vertical channel seaming, black bi-cast vinyl with x-stitch pattern and brown fabric with square pattern.",bedroom,https://s3-us-west-1.amazonaws.com/homelegance-resized/Images_MidRes_For+Customer+Advertisement/1831P-1.jpg
5789BK-1,Baldwyn Collection ,Homelegance,"A rolled and tufted headboard provides elegant touches to the casual Baldwyn Collection. Offered in black bi-cast vinyl and charcoal fabric, this bed offers not only flexible placement, but the opportunity to style the room to fit your needs.",bedroom,https://s3-us-west-1.amazonaws.com/homelegance-resized/Images_MidRes_For+Customer+Advertisement/5789BK Front View.jpg
1881PU-1,Deleon Collection ,Homelegance,"Designed for your modern home, the DeLeon Collection allows for your creativity and space allowance to create the room of your dreams. Serving as the canvas of your bedroom makeover, the dark brown bi-cast vinyl bed features a low-profile footboard and a dramatic diamond stitch pattern that adorns the headboard. Let your creativity flow with the addition of the DeLeon Collection.",bedroom,https://s3-us-west-1.amazonaws.com/homelegance-resized/Images_MidRes_For+Customer+Advertisement/1881PU.jpg
2159-1,Cumberland Collection ,Homelegance,"A classic addition to your transitional bedroom will be the Cumberland Collection. Traditional accents such as, the bun foot that supports each piece and rich medium brown finish on birch veneer, and selected hardwood blend with framing and lines that compliment your personal style. Hidden drawer storages in the night stand and dresser are a clever way to hide your valuables. The newly offered twin and full beds allow for placement that compliments both youth and modestly scaled spaces.",bedroom,https://s3-us-west-1.amazonaws.com/homelegance-resized/Images_MidRes_For+Customer+Advertisement/2159-1.jpg
1799-1,Clementine Collection ,Homelegance,"With a design as sweet as the name implies, the Clementine Collection will be a bright and classic addition for your bedroom sanctuary. Wooden knob hardware stands boldly against the double bow fronted case goods while the additional decorative accents of framed bead-board paneling and scalloped base carry over to the design of the turned post headboard and footboard - further enhancing the classic look of this lovely bedroom. The Clementine Collection is offered in youth as well.",bedroom,https://s3-us-west-1.amazonaws.com/homelegance-resized/Images_MidRes_For+Customer+Advertisement/1799-1.jpg
1845-1,Alonza Collection ,Homelegance,"Adding a bold touch of glamour to your boudoir is the Alonza Collection. Finished in a brilliant white, the embossed alligator board is reflected in the inlay mirrors of the bed and case pieces. The newly available back-lit LED headboard and mirror illuminate with a delicate touch, creating a dazzling glow. Turned feet provide a distinct departure from the linear design of the collection, adding a distinctly feminine flair. Drawer pulls add to the allure of the collection with an inlay crystal and chrome look.",bedroom,https://s3-us-west-1.amazonaws.com/homelegance-resized/Images_MidRes_For+Customer+Advertisement/1845.jpg
2147-1,Mayville Collection ,Homelegance,"Traditional in design and modest in scale, the elegant Mayville Collection takes its design inspiration from the classic Louis Philippe styling. Featuring four distinct finishes – burnished brown cherry, white, black, and the newly offered stained grey – with all of the traditional flare unique to the style – antiqued metal bale hardware and distinct framing – this collection is a perfect addition to your traditional adult or youth bedroom.",bedroom,https://s3-us-west-1.amazonaws.com/homelegance-resized/Images_MidRes_For+Customer+Advertisement/2147-1.jpg
2124-1,Townsford Collection ,Homelegance,The best of traditional style has been carefully assembled to create your ultimate bedroom suite. The Townsford Collection features unique turnings on the headboard and footboard posts with classic scalloped framing rounding out the bed design. Antiqued pewter hardware accents each case piece as does the bun feet that provide support. The rich dark cherry finish on cherry veneer further compliments this elegantly understated offering.,bedroom,https://s3-us-west-1.amazonaws.com/homelegance-resized/Images_MidRes_For+Customer+Advertisement/2124-1.jpg
