number,name,brand,description,category,image
2601-36,Tempe Collection ,Homelegance,"With a scale appropriate for any number of smaller dining spaces, the Tempe Collection will provide the look and style you want in your home. The transitional feel of the group comes from the richly hued faux marble table top and the minimalistic design of the dark brown bi-cast vinyl chairs. The table and chair are constructed of metal in black finish. The collection is available in counter or traditional dining heights.",dining,https://s3-us-west-1.amazonaws.com/homelegance-resized/Images_MidRes_For+Customer+Advertisement/2601-36.jpg
4727PU,Synergy Collection ,Homelegance,"The need for additional storage space in your modern home will be met with the Synergy Collection. The two segments of this ottoman serve equally as storage space, yet two different functional tops define each of their roles. With the first section, an airlift mechanism lifts the seat to reveal storage below. The second section is a fully extended lift top that not only reveals storage space, but will bring the seat top towards you for those times when you need an extra table surface. This padded ottoman is covered in dark brown bi-cast vinyl with white contrast stitching.",home,https://s3-us-west-1.amazonaws.com/homelegance-resized/Images_MidRes_For+Customer+Advertisement/4727PU.jpg
5447-36,Bayshore Collection ,Homelegance,Transitional aesthetic meets modern lines in the casually elegant Bayshore Collection. Offering flexibility in the collection are the options of two dining tables. The 47.5-inch fixed oak veneer square table top. And the rectangular oak veneer tabletop with leaf. Both tables feature quartered book-match walnut inlay veneers with a heavily burnished finish. Supporting the uniquely veneered table top is a storage table base with a display shelf. Both tables are complimented by dark brown bi-cast vinyl chairs that feature wood cap and legs. Coordinating server is also available.,dining,https://s3-us-west-1.amazonaws.com/homelegance-resized/Images_MidRes_For+Customer+Advertisement/5447-36.jpg
5100-84,Luella Collection ,Homelegance,"At home in a number of decorative styles, the Luella Collection will be the perfect match for your living space. Zinc table top is supported by X-frame bases in this casual dining offering. The table is flanked by coordinating chairs, each with a neutral tone fabric and nailhead accent. Completing the look is a cool weathered oak finish that serves as the perfect contrast to the natural grey tone of the zinc table top.",dining,https://s3-us-west-1.amazonaws.com/homelegance-resized/Images_MidRes_For+Customer+Advertisement/5100-84.jpg
5525-72,Fielding Collection ,Homelegance,"Classic soft modern styling creates the look of the Fielding Collection. Unfettered design makes for a classically refined profile, while black inset glass is utilized for perfect contrast to the brown finish of the wood table frame. Flanking the table are the side chairs, offered in either dark or light gray fabric. The accompanying server has drawer, behind door and wine rack storage for style and functional usage. Offered in both traditional and counter height for perfect placement in your dining room.",dining,https://s3-us-west-1.amazonaws.com/homelegance-resized/Images_MidRes_For+Customer+Advertisement/5525-72.jpg
5466-62,Festus Collection ,Homelegance,"Offered for your casual dining room is the Festus Collection. Extending to support and frame the corners of the light toned genuine marble tabletop are dark cherry finished legs. The coordinating chairs and bench feature dark brown bi-cast vinyl padded seats, each presenting a wrapped fold as the main focal accent.",dining,https://s3-us-west-1.amazonaws.com/homelegance-resized/Images_MidRes_For+Customer+Advertisement/5466-62.jpg
5438-1,Toulon Collection ,Homelegance,"Classic framing provides elegant contrast to the unique rustic look of the Toulon Collection. Wire-brushed distressing provides texture to the acacia veneer of this lovely bedroom suite. The functional drawers of the footboard allow for additional storage. The French provincial inspired routing lends decorative touch to each piece, while dual drawer and door storage are accented with wide set horizontal metal and wood hardware providing ample space to store your personal possessions.",bedroom,https://s3-us-west-1.amazonaws.com/homelegance-resized/Images_MidRes_For+Customer+Advertisement/5438.jpg
469PU,Claire Collection ,Homelegance,"This functional two-seat storage ottoman reverses to reveal 2 individual serving trays and 2 cleverly stored stools. Covered in dark brown bi-cast vinyl, this look is also offered in mottled brown polished microfiber.",occasional,https://s3-us-west-1.amazonaws.com/homelegance-resized/Images_MidRes_For+Customer+Advertisement/469PU.jpg
710-36RD,Daisy Collection,Homelegance,Daisy Collection combines superb visual appearance and fine quality that you need in your dining area. Three distinct elegant flared tulip bases support beveled glass tabletops on the rectangular and round traditional dining height tables and a round gathering height table. Additional offering is the trestle table with black glass insert. Counter and dining height chairs feature clean lines and sleek curves; available in both white and bi-cast vinyl and dark brown bi-cast vinyl. The set is constructed of hardwood solids and veneers in a refreshing espresso finish.,dining,https://s3-us-west-1.amazonaws.com/homelegance-resized/Images_MidRes_For+Customer+Advertisement/710-36RD.jpg
586-82,Ameillia Collection ,Homelegance,"The solid, clean lines of the Arts and Crafts movement are interpreted from modern times in the Ameillia Collection. Substantial tapered legs and the wood veneer complement this simple and refined dining offering. Newly offered in a grey with brown undertone finish, the collection is also available in a dark oak finish. The rectangular table is flanked by the perfectly coordinating chair or bench option.",dining,https://s3-us-west-1.amazonaws.com/homelegance-resized/Images_MidRes_For+Customer+Advertisement/586-82.jpg
5447-24S,Bayshore Collection ,Homelegance, ,dining,https://s3-us-west-1.amazonaws.com/homelegance-resized/Images_MidRes_For+Customer+Advertisement/5447-24S & 5447-29S.jpg
8507BE,Darby Collection ,Homelegance,"Creating a look that meets your needs for relaxation and entertaining is the Darby Collection. Covered in neutral fabric, this versatile sofa offers a clean contemporary look for your modern home. Weighted wedge seatbacks, along with coordinating toss pillows - featured in a primary color chevron pattern- can be configured to offer not only support, but provide customized seating as well. Configurations can include, but are not limited to: sofa, chaise or twin bed. Let your imagination runs wild with the Darby Collection.",seating,https://s3-us-west-1.amazonaws.com/homelegance-resized/Images_MidRes_For+Customer+Advertisement/8507BE_2014S-71.jpg
1885N-1,Zaira Collection ,Homelegance,The Zaira Collection offers modern traditional design showcasing beautiful nail head accenting headboard which elegantly contrasts its dark grey fabric.,bedroom,https://s3-us-west-1.amazonaws.com/homelegance-resized/Images_MidRes_For+Customer+Advertisement/1885N-1.jpg
586-60,Ameillia Collection ,Homelegance,"Blending the clean lines of Arts & Crafts with functional movement, the Ameillia Collection is a solid addition to your casual dining space. The drop-leaf counter height table features a Lazy-Susan making mealtime service a breeze. Substantial tapered legs and birch veneer in a dark oak finish complement this simple and refined dining option.",dining,https://s3-us-west-1.amazonaws.com/homelegance-resized/Images_MidRes_For+Customer+Advertisement/586-60.jpg
2042-1,Woodrow Collection ,Homelegance,Industrial design is subtly used to achieve a cool look for your bedroom in the Woodrow Collection. Dark metal hardware and corner banding with rivet look lend to the casual look of this bedroom group. Melamine laminate features a weathered-wood look that furthers the intended design. Black bi-cast vinyl accents of the headboard provides distinct complementing contrast to the finish of the collection.,bedroom,https://s3-us-west-1.amazonaws.com/homelegance-resized/Images_MidRes_For+Customer+Advertisement/2042-1.jpg
1915-60,Anika Collection ,Homelegance,"Drawing inspiration from Danish mid-century modern design, the Anika Collection is a stylish addition to your home’s dining space. The gentle curve of the table top is perfectly accentuated by the accompanying wood framed chairs, all featuring legs that are the signature to this classic look. Off-white bi-cast vinyl padded chair seats provide stark contrast to the light ash finish over ash veneer, furthering the contemporary design. The accompanying server features brushed nickel hardware and soft close mechanisms on the doors and storage drawers for quiet and sure closure.",dining,https://s3-us-west-1.amazonaws.com/homelegance-resized/Images_MidRes_For+Customer+Advertisement/1915-60.jpg
8202GRY-3,Sinclair Collection ,Homelegance,"A hint of retro styling provides a clean and classic look for your contemporary home in the Sinclair Collection. Offered in a traditional seating or sectional configuration, the options allow for the perfect placement within your living room. The collection is available in either chocolate or gray fabric with contrast pillows that furthers the look and versatility for placement within a number of home decors.",seating,https://s3-us-west-1.amazonaws.com/homelegance-resized/Images_MidRes_For+Customer+Advertisement/8202GRY_.jpg
5178-60,Watt Collection,Homelegance,Blending the visual impact of marble with the hyper-stylized look of metalwork is the Watt Collection. An intricately designed chrome finished metal base rises to support the faux marble look of the table top while continuous frame chairs – offered in dark grey or camel brown fabric with contrast stitching – further lend to the contemporary feel of this casual dining collection.,dining,https://s3-us-west-1.amazonaws.com/homelegance-resized/Images_MidRes_For+Customer+Advertisement/5178-60 5178BRS.jpg
1916-1,Allura Collection ,Homelegance,"Glamour reigns in the design of the Allura Collection. Framing each piece is a decorative beveled mirror accent that enhances the illumination from the touch-engaged LED back-light of the headboard and mirror, as well as the under-light of the night stand. Alligator embossing and high polished crystal-enhanced hardware boldly accent the silver finish of the collection.",bedroom,https://s3-us-west-1.amazonaws.com/homelegance-resized/Images_MidRes_For+Customer+Advertisement/1916-1.jpg
1708-1,Odelia Collection ,Homelegance,"Making a statement to the glamorous nature of your personal design aesthetic is the Odelia Collection. The striking silver finish of the collection serves to highlight the decorative accents that reign the design – crocodile embossed drawer fronts with polished nickel hardware, mirrored top drawer fronts with their faceted knob hardware and crystal-embellished button-tufted pearl bi-cast vinyl inserts on the headboard and foot board. The available twin, full, queen, Eastern King and California King bed options allow for perfect placement in your bedroom space.",bedroom,https://s3-us-west-1.amazonaws.com/homelegance-resized/Images_MidRes_For+Customer+Advertisement/1708-1.jpg
1856-1,Abbeville Collection ,Homelegance,"The ever popular Louis Philippe style is updated with functional accoutrements in the Abbeville Collection. Button and bale hardware grace the drawer fronts of each piece in the collection, while unbeknownst to the casual observer, there is hidden drawer storage on the nightstand, dresser and chest – each easily accessible with a pull of the front top frame. The sleigh bed furthers the timeless look of this adult collection, as well as youth. Okume veneers are elegantly highlighted with a traditional brown cherry finish.",bedroom,https://s3-us-west-1.amazonaws.com/homelegance-resized/Images_MidRes_For+Customer+Advertisement/1856-1.jpg
1845LED-1,Alonza Collection ,Homelegance,"Adding a bold touch of glamour to your boudoir is the Alonza Collection. Finished in a brilliant white, the embossed alligator board is reflected in the inlay mirrors of the bed and case pieces. The newly available back-lit LED headboard and mirror illuminate with a delicate touch, creating a dazzling glow. Turned feet provide a distinct departure from the linear design of the collection, adding a distinctly feminine flair. Drawer pulls add to the allure of the collection with an inlay crystal and chrome look.",bedroom,https://s3-us-west-1.amazonaws.com/homelegance-resized/Images_MidRes_For+Customer+Advertisement/1845LED-1.jpg
815TPU-1,Copley Collection ,Homelegance,"The Copley Collection features clean contemporary design that will complement any home d cor. With economical and environmental concerns in mind, the night stand, dresser and mirror are conveniently packed in one carton. Chest and additional night stands are also available. The Copley Collection showcases a wide beveled wood frame with satin nickel hardware accented in espresso finish on select hardwoods and veneers. To offer more flexibility, it offers three headboard options: wood sleigh headboard, panel headboard with white bi-case vinyl inserts, and fully upholstered dark brown bi-cast vinyl headboard.",bedroom,https://s3-us-west-1.amazonaws.com/homelegance-resized/Images_MidRes_For+Customer+Advertisement/815TPU-1.jpg
1737W-1,Lyric Collection ,Homelegance,"Taking the expected design elements of hard contemporary and putting a decidedly feminine curve into the mix makes the Lyric Collection a unique addition to your new bedroom design. With each curve comes a new twist - satin nickel hardware accents the glossy white finish, bow-front case pieces feature ball bearing drawer glides and compliment the padded sleigh headboard & footboard, while a round, contemporary mirror reflects the modern designs that you have selected. A final, unique, addition to the collection is the glass topped night stand that furthers the contemporary feel.",bedroom,https://s3-us-west-1.amazonaws.com/homelegance-resized/Images_MidRes_For+Customer+Advertisement/1737W-1.jpg
1935PN-1,Bonaventure Park Collection ,Homelegance,"With styling that exemplifies traditional design, the Bonaventure Park Collection exudes sophistication and refined elegance. Cantered pilasters frame the serpentine fronted case goods, while egg and dart molding, acanthus leaf motif and bale, and button hardware lend to the traditional look. Burl inlay creates beautiful contrast to the gold-highlighted warm cherry finish of the collection. Button tufting features prominently on the traditional low profile bed, while the footboard with heavy wood framing.",bedroom,https://s3-us-west-1.amazonaws.com/homelegance-resized/Images_MidRes_For+Customer+Advertisement/1935PN-1.jpg
8367TP-3,Emilio Collection ,Homelegance,"Subtle texture lends visual and tactile interest in the Emilio Collection. The set-up process allows you to configure the three-seat unit to accommodate the chaise on either the left or right side, providing for perfect placement within your living space. The accompanying ottoman can be an added comfort to put feet up when relaxing. The collection is offered in either taupe or chocolate, furthering the versatility of the sectional seating group.",seating,https://s3-us-west-1.amazonaws.com/homelegance-resized/Images_MidRes_For+Customer+Advertisement/8367TP-3 8367TP-5 8367TP-4.jpg
H10128,Elan Collection,Homelegance,"This accent lighting can change the ambiance of any room. Its ultra modern design showcases sparkling decorative mood light, with tiny rippling water-droplets to simulate the soothing dancing water motion. Beautifully crafted stand features high quality satin nickel finish metal and glass, and an elegant rectangular lamp shade. Great addition piece on your night stand, end table, or sofa table. It offers flexible lighting solution: a table lamp with a main light that is suitable for reading, perfect for a night light, and to create the mood in any room.",home,https://s3-us-west-1.amazonaws.com/homelegance-resized/Images_MidRes_For+Customer+Advertisement/H10128_lights on_c.jpg
8378BRW-L,Barrington Collection ,Homelegance,"Soft Contemporary styling lends a cool, classic look to your modern living space in the Barrington Collection. Stitch tufting provides soft contrast to the cleanly designed lines of this seating arrangement. The attached chaise lounge and accompanying ottoman provide the opportunity for putting your feet up while you enjoy your downtime. The seating group is offered in gray, black and brown bi-cast vinyl.",seating,https://s3-us-west-1.amazonaws.com/homelegance-resized/Images_MidRes_For+Customer+Advertisement/8378BRW-L -R -4.jpg
1867,Florentina Collection ,Homelegance,"The elaborate designs of Old World Europe are treated with a distinct modern touch in the Florentina Collection. The eye-catching jewel tufting of the headboard reflects with a brilliance intended to accentuate the dusky taupe coloring of the faux silk and the rich silver – with gold undertone- finish of the wood veneer. Bombe case goods present their distinct shape as a unique focal point in your elegant bedroom. With details such as shell and acanthus leaf scrolling, carved cabriole feet and delicately designed knob hardware, the traditional look of the collection is solidified.",bedroom,https://s3-us-west-1.amazonaws.com/homelegance-resized/Images_MidRes_For+Customer+Advertisement/1867.jpg
8378BLK-L,Barrington Collection ,Homelegance,"Soft Contemporary styling lends a cool, classic look to your modern living space in the Barrington Collection. Stitch tufting provides soft contrast to the cleanly designed lines of this seating arrangement. The attached chaise lounge and accompanying ottoman provide the opportunity for putting your feet up while you enjoy your downtime. The seating group is offered in gray, black and brown bi-cast vinyl.",seating,https://s3-us-west-1.amazonaws.com/homelegance-resized/Images_MidRes_For+Customer+Advertisement/8378BLK-L -R -4.jpg
8200BRW-3PW,Mahala Collection ,Homelegance,"Plush seating is paired with brown top grain leather and vinyl match in the Mahala Collection to create the ultimate platform for relaxation. Offered in two reclining options, a manual or power engaged. The motion mechanisms allow for quick transition from seated to prone with either the quick pull of the manual tab or the push of the power button.",seating,https://s3-us-west-1.amazonaws.com/homelegance-resized/Images_MidRes_For+Customer+Advertisement/8200BRW.jpg
5510-66,Seaford Collection ,Homelegance,Subtle industrial influence creates the visual appeal of the casual dining tables of the Seaford Collection. V-matched veneer is finished in a gray tone highlights the tone variation of the wood grain. Angled trestle bases support the table tops of the collection while X-back chairs feature bi-cast vinyl padded seats for comfort.,dining,https://s3-us-west-1.amazonaws.com/homelegance-resized/Images_MidRes_For+Customer+Advertisement/5510-66.jpg
8245GY-3,Kenner Collection ,Homelegance,A classic and functional option for your living room is the Kenner Collection. Unfettered design allows for your individual decorative aspirations to soar. The sofa is available in both a pull out sleeper or traditional setup. The sofa and love seat are paired with contrast pillows. Two fabric options are available – Gray or Brown fabric – for versatile placement in a number of environments.,seating,https://s3-us-west-1.amazonaws.com/homelegance-resized/Images_MidRes_For+Customer+Advertisement/8245GY.jpg
5510-36,Seaford Collection ,Homelegance,Subtle industrial influence creates the visual appeal of the casual dining tables of the Seaford Collection. V-matched veneer is finished in a gray tone highlights the tone variation of the wood grain. Angled trestle bases support the table tops of the collection while X-back chairs feature bi-cast vinyl padded seats for comfort.,dining,https://s3-us-west-1.amazonaws.com/homelegance-resized/Images_MidRes_For+Customer+Advertisement/5510-36.jpg
B2053SBW-1,Galen Collection ,Homelegance,"Providing flexible options to fit any size bedroom is the Galen Collection. This transitional bedroom group is featured in a white finish making it an appropriate choice for a number of youth bedroom settings. With twin over full, twin over twin, full over full configurations - along the newly available captains bed, with trundle that features two drawers, and twin/twin bunk with storage stair steps - the design allows you to choose the size that is right for your family. Two under bed options are available for the bunk beds - toy boxes that provide additional storage space or twin trundle that offers additional sleep space.",youth,https://s3-us-west-1.amazonaws.com/homelegance-resized/Images_MidRes_For+Customer+Advertisement/B2053SBW-1.jpg
1192RN,Lucille Collection ,Homelegance,"Retro lines need not stay in the past with the mid-century inspired lines of the Lucille Collection. With fabric offerings that range from neutral to bold such as beige, gray, blue, and orange further complemented with button-tufted accenting and stylishly appointed legs, this classic accent chair will provide a look that shows your personal style.",seating,https://s3-us-west-1.amazonaws.com/homelegance-resized/Images_MidRes_For+Customer+Advertisement/1192RN.jpg
8228TP,Ferriday Collection ,Homelegance,"Providing the flexible option for relaxation, sleep and storage, the Ferriday Collection will be a stylish and functional addition to your living room. Under seat storage is revealed with the pull of a tab on the end chaise. The lower portion of the seating configuration pulls out to reveal a pop up trundle that creates a bed space creating a relaxing environment with minimal effort. The collection is offered in blue or taupe fabric, both with contrast stitching.",seating,https://s3-us-west-1.amazonaws.com/homelegance-resized/Images_MidRes_For+Customer+Advertisement/8228TP.jpg
8312DG-3,Anke Collection ,Homelegance,Mid-Century modern Danish styling serves as the driving design inspiration in the Anke Collection. Offered in two colors – light or dark grey – each serves as a distinct contrast to the light ash or walnut finished legs. Button tufting provides focal interest as subtly curved low-profile arms give way to the slightly splayed back.,seating,https://s3-us-west-1.amazonaws.com/homelegance-resized/Images_MidRes_For+Customer+Advertisement/8312DG.jpg
8437-1LT,Iola Collection ,Homelegance,"Traditionally styled for your living space, the Iola Collection will provide you with a functional chair to fit your personal needs. Via the attached controller, you are taken from seating to reclining or standing position. The taupe 100% polyester cover, rolled arms and nail head accent further lend the classic look of the collection.",seating,https://s3-us-west-1.amazonaws.com/homelegance-resized/Images_MidRes_For+Customer+Advertisement/8437-1LT.jpg
5488-36RD,Beacher Collection ,Homelegance,"Elevating to suit your needs, the Beacher Collection is a fun and functional addition to your industrial styled home. Metal legs rise to support the turn-rod adjustable height table and stools creating a platform that can be customized at any given time. Weathered wood veneer is segmented into a quadrant pattern on the tabletop for visual interest with faux riveted metal banding providing accent to the table and stools.",dining,https://s3-us-west-1.amazonaws.com/homelegance-resized/Images_MidRes_For+Customer+Advertisement/5488-36RD.jpg
8511TP,Talon Collection ,Homelegance,"Designed with numerous room decors in mind, the transitional Talon Collection will be the perfect option for your living room. This stationary group features amply stuffed seating and a bonded leather match covering that is offered in either taupe or black.",seating,https://s3-us-west-1.amazonaws.com/homelegance-resized/Images_MidRes_For+Customer+Advertisement/8511TP_2546-31_2014S-92.jpg
9734BR-3,Rubin Collection ,Homelegance,"With base design elements that touch retro styling, the Rubin Collection is a perfect option for your modern home. Light brown or chocolate Champion microfiber allows for versatile placement in a number of living room d cor themes. Coordinating toss pillows compliment the clean look of the collection.",seating,https://s3-us-west-1.amazonaws.com/homelegance-resized/Images_MidRes_For+Customer+Advertisement/9734BR_3402-30.jpg
1737NC-1,Lyric Collection ,Homelegance,"Taking the expected design elements of hard contemporary and putting a decidedly feminine curve into the mix makes the Lyric Collection a unique addition to your new bedroom design. With each curve comes a new twist - satin nickel hardware accents the glossy white or dark espresso finish, bow-front case pieces feature ball bearing drawer glides and compliment the padded sleigh headboard & footboard, while a round, contemporary mirror reflects the modern designs that you have selected. A final unique addition to the collection is the glass-topped night stand that furthers the contemporary feel.",bedroom,https://s3-us-west-1.amazonaws.com/homelegance-resized/Images_MidRes_For+Customer+Advertisement/1737NC-1.jpg
